{
  "id": "kairos-lol-academy-blue",
  "slug": "kairos-lol-academy-blue",
  "name": "Kairos Academy Blue",
  "shortName": "Academy Blue",
  "organization": {
    "id": "kairos-esports",
    "name": "Kairos Esports"
  },
  "game": "League of Legends",
  "level": "academy-blue",
  "intendedCompetition": "NACL",
  "status": "active-training-pre-debut",
  "currentStoryPeriod": {
    "period": "mid-december-2026",
    "displayName": "Mid December 2026",
    "exactDate": "2026-12-18",
    "exactYear": "2026"
  },
  "officialDebutPeriod": {
    "status": "planned",
    "month": "February",
    "exactDate": "TBD",
    "exactYear": "2027"
  },
  "roster": [
    "connor-mako-sullivan",
    "jacob-xnox-price",
    "owen-kite-hughes",
    "tyler-murmur-grant",
    "lucas-grit-foster"
  ],
  "coachingStaff": [
    "hai-du-lam"
  ],
  "mentors": [
    "zaqueri-aphromoo-black"
  ],
  "captain": "TBD",
  "trainingLocation": {
    "city": "Los Angeles",
    "region": "California",
    "country": "United States"
  },
  "competitiveHistory": [],
  "achievements": [],
  "statistics": {},
  "confirmedFacts": [
    "Academy Blue is intended for the NACL.",
    "The five-player roster is active and training.",
    "The League division previously completed a Korean bootcamp and returned to Los Angeles.",
    "Academy Blue has not played an official match.",
    "The full Academy Blue roster participated in the 2026-11-07 Kairos community vote.",
    "The next competitive milestone is February 2027.",
    "Aphromoo expands Academy mentorship with a focus on professional habits and player development.",
    "Communication and team culture are measurable development goals.",
    "Academy performance continues improving internally.",
    "Connor \"Mako\" Sullivan is Top, born 2007-12-16, and age 18 on 2026-11-24.",
    "Jacob \"xNox\" Price is Jungle, born 2009-04-08, and age 17 on 2026-11-24.",
    "Owen \"Kite\" Hughes is Mid, born 2008-02-27, and age 18 on 2026-11-24.",
    "Tyler \"Murmur\" Grant is ADC, born 2009-08-19, and age 17 on 2026-11-24.",
    "Lucas \"Grit\" Foster is Support, born 2008-11-05, and age 18 on 2026-11-24.",
    "The current narrative date is 2026-12-18.",
    "Hai Du Lam accepted the Academy Blue Head Coach position in Episode 85 and is active by Episode 89.",
    "The December Phase Two plan is established in Episode 75.",
    "Academy Blue will focus on consistency and meaningful internal pressure during Phase Two."
  ],
  "unconfirmedDetails": [
    "Player cities, nationalities, personalities, and playstyles remain TBD.",
    "The captain is TBD.",
    "Exact employment start date and contract terms for Hai are TBD.",
    "Exact founding and early-2026 roster-formation dates are TBD.",
    "The exact competitive milestone date in February 2027 is TBD.",
    "Contracts, salaries, future results, rankings, and statistics are TBD."
  ],
  "canonNotes": [
    "Kite's role is source-backed and does not rely on roster-order inference.",
    "NACL is the intended destination, not a completed competition entry.",
    "Academy Blue exists for real player development and progression.",
    "All five roles and birth dates are confirmed canon; the captain remains TBD."
  ]
}
